{
  "schemaVersion": 1,
  "siteUrl": "sc-domain:framepact.jp",
  "sitemapUrl": "https://framepact.jp/sitemap.xml",
  "generatedAt": "2026-10-31T15:02:17+09:00",
  "lastSitemapSubmissionAt": "2026-10-31T13:24:38+09:00",
  "pages": [
    {
      "url": "https://framepact.jp/",
      "pageType": "home",
      "publishedAt": null,
      "lastModified": "2026-10-31",
      "sitemapIncluded": true,
      "sitemapSubmittedAt": "2026-10-31T13:24:38+09:00",
      "inspectionStatus": "PASS",
      "coverageState": "送信して登録されました",
      "indexingState": "INDEXING_ALLOWED",
      "robotsTxtState": "ALLOWED",
      "googleCanonical": "https://framepact.jp/",
      "userCanonical": "https://framepact.jp/",
      "lastCrawlTime": "2026-10-29T09:00:43Z",
      "referringUrls": null,
      "pageFetchState": "SUCCESSFUL",
      "errorInfo": null,
      "inspectedAt": "2026-10-31T13:24:39+09:00",
      "retryAfter": "2026-11-01T13:24:39+09:00",
      "consecutiveApiFailures": 0,
      "ownerActionRequired": false,
      "notes": ""
    },
    {
      "url": "https://framepact.jp/corporate-ai-video.html",
      "pageType": "service",
      "publishedAt": null,
      "lastModified": "2026-10-25",
      "sitemapIncluded": true,
      "sitemapSubmittedAt": "2026-10-31T13:24:38+09:00",
      "inspectionStatus": "PASS",
      "coverageState": "送信して登録されました",
      "indexingState": "INDEXING_ALLOWED",
      "robotsTxtState": "ALLOWED",
      "googleCanonical": "https://framepact.jp/corporate-ai-video.html",
      "userCanonical": "https://framepact.jp/corporate-ai-video.html",
      "lastCrawlTime": "2026-09-09T18:52:24Z",
      "referringUrls": null,
      "pageFetchState": "SUCCESSFUL",
      "errorInfo": null,
      "inspectedAt": "2026-10-31T13:24:39+09:00",
      "retryAfter": "2026-11-01T13:24:39+09:00",
      "consecutiveApiFailures": 0,
      "ownerActionRequired": false,
      "notes": ""
    },
    {
      "url": "https://framepact.jp/ai-video-price.html",
      "pageType": "service",
      "publishedAt": null,
      "lastModified": "2026-08-03",
      "sitemapIncluded": true,
      "sitemapSubmittedAt": "2026-10-31T13:24:38+09:00",
      "inspectionStatus": "PASS",
      "coverageState": "送信して登録されました",
      "indexingState": "INDEXING_ALLOWED",
      "robotsTxtState": "ALLOWED",
      "googleCanonical": "https://framepact.jp/ai-video-price.html",
      "userCanonical": "https://framepact.jp/ai-video-price.html",
      "lastCrawlTime": "2026-10-10T18:07:41Z",
      "referringUrls": null,
      "pageFetchState": "SUCCESSFUL",
      "errorInfo": null,
      "inspectedAt": "2026-10-31T13:24:39+09:00",
      "retryAfter": "2026-11-01T13:24:39+09:00",
      "consecutiveApiFailures": 0,
      "ownerActionRequired": false,
      "notes": ""
    },
    {
      "url": "https://framepact.jp/no-material-ai-video.html",
      "pageType": "service",
      "publishedAt": null,
      "lastModified": "2026-10-25",
      "sitemapIncluded": true,
      "sitemapSubmittedAt": "2026-10-31T13:24:38+09:00",
      "inspectionStatus": "PASS",
      "coverageState": "送信して登録されました",
      "indexingState": "INDEXING_ALLOWED",
      "robotsTxtState": "ALLOWED",
      "googleCanonical": "https://framepact.jp/no-material-ai-video.html",
      "userCanonical": "https://framepact.jp/no-material-ai-video.html",
      "lastCrawlTime": "2026-10-30T03:56:56Z",
      "referringUrls": null,
      "pageFetchState": "SUCCESSFUL",
      "errorInfo": null,
      "inspectedAt": "2026-10-31T13:24:39+09:00",
      "retryAfter": "2026-11-01T13:24:39+09:00",
      "consecutiveApiFailures": 0,
      "ownerActionRequired": false,
      "notes": ""
    },
    {
      "url": "https://framepact.jp/corporate-pr-video.html",
      "pageType": "service",
      "publishedAt": null,
      "lastModified": "2026-10-31",
      "sitemapIncluded": true,
      "sitemapSubmittedAt": "2026-10-31T13:24:38+09:00",
      "inspectionStatus": "PASS",
      "coverageState": "送信して登録されました",
      "indexingState": "INDEXING_ALLOWED",
      "robotsTxtState": "ALLOWED",
      "googleCanonical": "https://framepact.jp/corporate-pr-video.html",
      "userCanonical": "https://framepact.jp/corporate-pr-video.html",
      "lastCrawlTime": "2026-10-25T13:03:48Z",
      "referringUrls": null,
      "pageFetchState": "SUCCESSFUL",
      "errorInfo": null,
      "inspectedAt": "2026-10-31T13:24:39+09:00",
      "retryAfter": "2026-11-01T13:24:39+09:00",
      "consecutiveApiFailures": 0,
      "ownerActionRequired": false,
      "notes": ""
    },
    {
      "url": "https://framepact.jp/recruit-video.html",
      "pageType": "service",
      "publishedAt": null,
      "lastModified": "2026-08-03",
      "sitemapIncluded": true,
      "sitemapSubmittedAt": "2026-10-31T13:24:38+09:00",
      "inspectionStatus": "PASS",
      "coverageState": "送信して登録されました",
      "indexingState": "INDEXING_ALLOWED",
      "robotsTxtState": "ALLOWED",
      "googleCanonical": "https://framepact.jp/recruit-video.html",
      "userCanonical": "https://framepact.jp/recruit-video.html",
      "lastCrawlTime": "2026-10-05T09:21:29Z",
      "referringUrls": null,
      "pageFetchState": "SUCCESSFUL",
      "errorInfo": null,
      "inspectedAt": "2026-10-31T13:24:39+09:00",
      "retryAfter": "2026-11-01T13:24:39+09:00",
      "consecutiveApiFailures": 0,
      "ownerActionRequired": false,
      "notes": ""
    },
    {
      "url": "https://framepact.jp/training-video.html",
      "pageType": "service",
      "publishedAt": null,
      "lastModified": "2026-10-31",
      "sitemapIncluded": true,
      "sitemapSubmittedAt": "2026-10-31T13:24:38+09:00",
      "inspectionStatus": "PASS",
      "coverageState": "送信して登録されました",
      "indexingState": "INDEXING_ALLOWED",
      "robotsTxtState": "ALLOWED",
      "googleCanonical": "https://framepact.jp/training-video.html",
      "userCanonical": "https://framepact.jp/training-video.html",
      "lastCrawlTime": "2026-09-30T22:00:18Z",
      "referringUrls": [
        "https://framepact.jp/sitemap.xml"
      ],
      "pageFetchState": "SUCCESSFUL",
      "errorInfo": null,
      "inspectedAt": "2026-10-31T13:24:39+09:00",
      "retryAfter": "2026-11-01T13:24:39+09:00",
      "consecutiveApiFailures": 0,
      "ownerActionRequired": false,
      "notes": ""
    },
    {
      "url": "https://framepact.jp/event-video.html",
      "pageType": "service",
      "publishedAt": null,
      "lastModified": "2026-10-31",
      "sitemapIncluded": true,
      "sitemapSubmittedAt": "2026-10-31T13:24:38+09:00",
      "inspectionStatus": "PASS",
      "coverageState": "送信して登録されました",
      "indexingState": "INDEXING_ALLOWED",
      "robotsTxtState": "ALLOWED",
      "googleCanonical": "https://framepact.jp/event-video.html",
      "userCanonical": "https://framepact.jp/event-video.html",
      "lastCrawlTime": "2026-10-30T04:34:26Z",
      "referringUrls": null,
      "pageFetchState": "SUCCESSFUL",
      "errorInfo": null,
      "inspectedAt": "2026-10-31T13:24:39+09:00",
      "retryAfter": "2026-11-01T13:24:39+09:00",
      "consecutiveApiFailures": 0,
      "ownerActionRequired": false,
      "notes": ""
    },
    {
      "url": "https://framepact.jp/exhibition-video.html",
      "pageType": "service",
      "publishedAt": null,
      "lastModified": "2026-09-08",
      "sitemapIncluded": true,
      "sitemapSubmittedAt": "2026-10-31T13:24:38+09:00",
      "inspectionStatus": "PASS",
      "coverageState": "送信して登録されました",
      "indexingState": "INDEXING_ALLOWED",
      "robotsTxtState": "ALLOWED",
      "googleCanonical": "https://framepact.jp/exhibition-video.html",
      "userCanonical": "https://framepact.jp/exhibition-video.html",
      "lastCrawlTime": "2026-10-29T15:15:36Z",
      "referringUrls": [
        "https://framepact.jp/sitemap.xml"
      ],
      "pageFetchState": "SUCCESSFUL",
      "errorInfo": null,
      "inspectedAt": "2026-10-31T13:24:39+09:00",
      "retryAfter": "2026-11-01T13:24:39+09:00",
      "consecutiveApiFailures": 0,
      "ownerActionRequired": false,
      "notes": ""
    },
    {
      "url": "https://framepact.jp/column.html",
      "pageType": "column_index",
      "publishedAt": null,
      "lastModified": "2026-10-31",
      "sitemapIncluded": true,
      "sitemapSubmittedAt": "2026-10-31T13:24:38+09:00",
      "inspectionStatus": "PASS",
      "coverageState": "送信して登録されました",
      "indexingState": "INDEXING_ALLOWED",
      "robotsTxtState": "ALLOWED",
      "googleCanonical": "https://framepact.jp/column.html",
      "userCanonical": "https://framepact.jp/column.html",
      "lastCrawlTime": "2026-10-30T17:05:53Z",
      "referringUrls": [
        "https://framepact.jp/column",
        "https://framepact.jp/sitemap.xml"
      ],
      "pageFetchState": "SUCCESSFUL",
      "errorInfo": null,
      "inspectedAt": "2026-10-31T13:24:39+09:00",
      "retryAfter": "2026-11-01T13:24:39+09:00",
      "consecutiveApiFailures": 0,
      "ownerActionRequired": false,
      "notes": ""
    },
    {
      "url": "https://framepact.jp/what-is-ai-video-production.html",
      "pageType": "column",
      "publishedAt": null,
      "lastModified": "2026-08-03",
      "sitemapIncluded": true,
      "sitemapSubmittedAt": "2026-10-31T13:24:38+09:00",
      "inspectionStatus": "PASS",
      "coverageState": "送信して登録されました",
      "indexingState": "INDEXING_ALLOWED",
      "robotsTxtState": "ALLOWED",
      "googleCanonical": "https://framepact.jp/what-is-ai-video-production.html",
      "userCanonical": "https://framepact.jp/what-is-ai-video-production.html",
      "lastCrawlTime": "2026-10-30T05:11:59Z",
      "referringUrls": null,
      "pageFetchState": "SUCCESSFUL",
      "errorInfo": null,
      "inspectedAt": "2026-10-31T13:24:39+09:00",
      "retryAfter": "2026-11-01T13:24:39+09:00",
      "consecutiveApiFailures": 0,
      "ownerActionRequired": false,
      "notes": ""
    },
    {
      "url": "https://framepact.jp/ai-video-vs-traditional-video.html",